{
  "job_id": "job_001",
  "run_id": "run_abc",
  "repo": {
    "id": "repo_456",
    "clone_url": "https://git.skillbook.example.com/trendhype/hello-skill.git",
    "commit_sha": "bbbbbbbbbbbbbbbbbbbbbbbbbbbbbbbbbbbbbbbb"
  },
  "trigger": "pull_request",
  "checks": [
    "manifest.parse",
    "skillmd.present",
    "security.no_secrets",
    "license.present",
    "semver.valid",
    "paths.safe"
  ],
  "limits": {
    "timeout_seconds": 900,
    "max_memory_mb": 1024,
    "max_disk_mb": 4096,
    "network": "egress_only"
  },
  "callbacks": {
    "results_url": "https://api.skillbook.example.com/v1/validation/runs/run_abc/results",
    "logs_url": "https://api.skillbook.example.com/v1/validation/runs/run_abc/logs"
  }
}